{
  "$schema": "schemas/production-lifecycle-public.schema.json",
  "derivation": {
    "expired_or_revoked_latest_behavior": "no_production",
    "fallback_to_older_release": false,
    "mode": "latest_signed_admission_at_read_time",
    "static_production_state": false
  },
  "maximum_admission_days": 30,
  "policy_revision": 7,
  "schema_version": "openadapt.public-production-lifecycle/v1",
  "source": {
    "files": {
      "admissions": {
        "path": "production-lifecycle-admissions.json",
        "sha256": "sha256:8859deeb4ff2dc7704dc56eb0e356f10afa127d7e9e768a8d803cc97f6e61cf5",
        "url": "https://raw.githubusercontent.com/OpenAdaptAI/.github/5b48240494a250633eec8fcf99fab26553efd0c6/production-lifecycle-admissions.json"
      },
      "admissions_schema": {
        "path": "schemas/production-lifecycle-admissions.schema.json",
        "sha256": "sha256:33ad1421fafeef7780183bfd20100bada03111bc9b3eb06319097b6f0e61365f",
        "url": "https://raw.githubusercontent.com/OpenAdaptAI/.github/5b48240494a250633eec8fcf99fab26553efd0c6/schemas/production-lifecycle-admissions.schema.json"
      },
      "evidence_manifest_schema": {
        "path": "schemas/production-lifecycle-evidence-manifest.schema.json",
        "sha256": "sha256:d720f9676dde3ea6deb9d3a2b91bcd8eae8fcecc2cafaef17a0d055391cee860",
        "url": "https://raw.githubusercontent.com/OpenAdaptAI/.github/5b48240494a250633eec8fcf99fab26553efd0c6/schemas/production-lifecycle-evidence-manifest.schema.json"
      },
      "evidence_registry": {
        "path": "evidence-registry.json",
        "sha256": "sha256:549c8559c7225ce55e8d35f16ecd9845f83e8d52483c98cf846f0417f4c7e4e7",
        "url": "https://raw.githubusercontent.com/OpenAdaptAI/.github/5b48240494a250633eec8fcf99fab26553efd0c6/evidence-registry.json"
      },
      "evidence_registry_schema": {
        "path": "schemas/evidence-registry.schema.json",
        "sha256": "sha256:3159f1e13360acedf51de79a3d8f910db65530dcf545659a861ea4ccb6e12869",
        "url": "https://raw.githubusercontent.com/OpenAdaptAI/.github/5b48240494a250633eec8fcf99fab26553efd0c6/schemas/evidence-registry.schema.json"
      },
      "evidence_registry_validator": {
        "path": "scripts/validate_evidence_registry.py",
        "sha256": "sha256:aea4d61cb5becb46f2853c7f765aba7a27b8f0737ae9a5f8d240def780e6c628",
        "url": "https://raw.githubusercontent.com/OpenAdaptAI/.github/5b48240494a250633eec8fcf99fab26553efd0c6/scripts/validate_evidence_registry.py"
      },
      "evidence_summary_schema": {
        "path": "schemas/production-lifecycle-evidence-summary.schema.json",
        "sha256": "sha256:5d5f28261568222f45e9a66d9c9daf468168147f9d0d82d223eba1b8e777e2c9",
        "url": "https://raw.githubusercontent.com/OpenAdaptAI/.github/5b48240494a250633eec8fcf99fab26553efd0c6/schemas/production-lifecycle-evidence-summary.schema.json"
      },
      "lifecycle": {
        "path": "repository-lifecycle.yml",
        "sha256": "sha256:823933a80ac4459f7359719f69dfeb7f164e940918ad4811d789eb2040bfc50b",
        "url": "https://raw.githubusercontent.com/OpenAdaptAI/.github/5b48240494a250633eec8fcf99fab26553efd0c6/repository-lifecycle.yml"
      },
      "policy": {
        "path": "production-lifecycle-policy.json",
        "sha256": "sha256:1887a1222f5c34a6bd3e2a03f8aa2b55368c66bb9e6cad109a0c5c1ed0b5c524",
        "url": "https://raw.githubusercontent.com/OpenAdaptAI/.github/5b48240494a250633eec8fcf99fab26553efd0c6/production-lifecycle-policy.json"
      },
      "policy_schema": {
        "path": "schemas/production-lifecycle-policy.schema.json",
        "sha256": "sha256:c5d3157a7be841351b39f3ec8a8f6433de6d16b85ae0b1c61800d2c052aaa734",
        "url": "https://raw.githubusercontent.com/OpenAdaptAI/.github/5b48240494a250633eec8fcf99fab26553efd0c6/schemas/production-lifecycle-policy.schema.json"
      },
      "validator": {
        "path": "scripts/validate_production_lifecycle.py",
        "sha256": "sha256:04c3945106fb1004535be531931eab58b5e7c209668f3602628c909ece669333",
        "url": "https://raw.githubusercontent.com/OpenAdaptAI/.github/5b48240494a250633eec8fcf99fab26553efd0c6/scripts/validate_production_lifecycle.py"
      }
    },
    "repository": "OpenAdaptAI/.github",
    "schema_version": "openadapt.production-lifecycle-source/v1",
    "source_commit": "5b48240494a250633eec8fcf99fab26553efd0c6"
  },
  "targets": [
    {
      "admission_history": [
        {
          "admission_id_sha256": "sha256:2a26077d8a399b30a49bd66292d36c239f393907657a2e1ec9f2061f8d5be782",
          "artifact_inventory_sha256": "sha256:1bcacafb2d9ad69b5554cdb6dea73801925eff91d84232163fa66deac30252b4",
          "authority_state_sha256": "sha256:df5079141df68877c4b06f05b9fb9fdf279307b7629eb1f2dce12def4bd5e2fa",
          "claim_scope": "production_agent",
          "evidence_class": "remote-safe-synthetic",
          "expires_at": null,
          "issued_at": "2026-09-02T19:22:47Z",
          "issuer": {
            "environment": "production-release-admission",
            "ref": "refs/heads/main",
            "repository": "OpenAdaptAI/.github",
            "repository_id": "858454062",
            "repository_owner_id": "132681217",
            "source_commit": "78aebd3c98e66943eb3da0144945199300f16323",
            "workflow": ".github/workflows/issue-production-release-admission.yml"
          },
          "not_before": "2026-09-02T19:22:47Z",
          "production_acceptance_summary_bundle_reference": {
            "kind": "production-acceptance-summary-sigstore-bundle",
            "object_media_type": "application/vnd.dev.sigstore.bundle.v0.3+json",
            "object_path": "production-evidence/objects/sha256/2f/2f9607f70fff6dc58c7daa10881843330a4f68898fdc353ed89c252604894c6f.production-acceptance-summary-sigstore-bundle.json",
            "object_schema_version": "application/vnd.dev.sigstore.bundle.v0.3+json",
            "object_sha256": "sha256:2f9607f70fff6dc58c7daa10881843330a4f68898fdc353ed89c252604894c6f",
            "registry_entry_sha256": "sha256:f5152783ec1d5b0a2544112bf0e576a212fbeaf47753c525a821c144c5f20e96",
            "registry_head_sha256": "sha256:af838bbd6be8efde7107d7167386afa94fd640a970d39f08de6537afa4ccbcdf",
            "registry_revision": 1,
            "registry_source_commit": "78aebd3c98e66943eb3da0144945199300f16323",
            "repository": "OpenAdaptAI/.github",
            "repository_id": "858454062",
            "repository_owner_id": "132681217",
            "schema_version": "openadapt.production-evidence-object-reference/v2",
            "semantic_identity_sha256": "sha256:3942280117f8d27d96df8d2286be68db34812cd6bc82f1fe44078dea70362122",
            "size_bytes": 2789,
            "subject_sha256": "sha256:cd069825424547c09e14cd5c42b9aa1653dd693db82645e2ce07884befaca056"
          },
          "production_acceptance_summary_reference": {
            "kind": "production-acceptance-summary",
            "object_media_type": "application/vnd.openadapt.production-lifecycle-evidence-summary+json;version=3",
            "object_path": "production-evidence/objects/sha256/cd/cd069825424547c09e14cd5c42b9aa1653dd693db82645e2ce07884befaca056.production-acceptance-summary.json",
            "object_schema_version": "openadapt.production-lifecycle-evidence-summary/v3",
            "object_sha256": "sha256:cd069825424547c09e14cd5c42b9aa1653dd693db82645e2ce07884befaca056",
            "registry_entry_sha256": "sha256:5111f8844764864715f630ac4b75e9d34b825a319e8258e1c23ccd62a19b42e7",
            "registry_head_sha256": "sha256:af838bbd6be8efde7107d7167386afa94fd640a970d39f08de6537afa4ccbcdf",
            "registry_revision": 1,
            "registry_source_commit": "78aebd3c98e66943eb3da0144945199300f16323",
            "repository": "OpenAdaptAI/.github",
            "repository_id": "858454062",
            "repository_owner_id": "132681217",
            "schema_version": "openadapt.production-evidence-object-reference/v2",
            "semantic_identity_sha256": "sha256:c7b64defaf300207e81f0376c58bf6b17716d76f4cc21b8033c6bdc5acdc49d9",
            "size_bytes": 14395,
            "subject_sha256": null
          },
          "publication_policy_sha256": "sha256:ed5ab69fe8127604ca674263cbc8c774b7cfd10754e90bfaa9b71ba573bce1d1",
          "publication_staging": {
            "assets": [
              {
                "asset_id": null,
                "kind": "python-wheel",
                "media_type": "application/zip",
                "name": "openadapt_agent-2.0.1-py3-none-any.whl",
                "publish_destinations": [
                  "github-release",
                  "pypi"
                ],
                "sha256": "sha256:5c5f6e3eca4c127d87b3affb8944223c0836916e0df57d0c6b8ba737b3bc8b5a",
                "size_bytes": 34183,
                "uploader_id": null,
                "uploader_login": null
              },
              {
                "asset_id": null,
                "kind": "python-sdist",
                "media_type": "application/gzip",
                "name": "openadapt_agent-2.0.1.tar.gz",
                "publish_destinations": [
                  "github-release",
                  "pypi"
                ],
                "sha256": "sha256:67e05b299a4f035a0482b3032decc151fafc22de9a12bb3d8f884f37ea4cc937",
                "size_bytes": 61814,
                "uploader_id": null,
                "uploader_login": null
              }
            ],
            "draft": false,
            "draft_release_id": null,
            "immutable_releases": {
              "enabled": true,
              "enforced_by_owner": false
            },
            "immutable_releases_sha256": "sha256:07649aafb167237fecc138f5e93b48ddce5a69f4060da7130e3c78e59fd48581",
            "observed_at": "2026-09-02T19:22:47Z",
            "prerelease": false,
            "publication_mode": "already-published-pypi",
            "pypi_files": [
              {